{
  "version": "20260916-2.0",
  "status": "ACTIVE",
  "description": "Food-to-nutrient (vitamin/mineral) relationships across the full nutrient catalogue, matching the completeness and shape established for food-bioactives.json. No quantities/RDA values are encoded - relationships indicate that a food is a genuinely notable dietary source, not a specific dose.",
  "scope": "All 29 vitamins and minerals in vitamins.json/minerals.json, superseding the earlier 8-nutrient priority-only first pass.",
  "guardrails": [
    "Food nutrient content varies by cultivar, species, soil, processing, fortification and preparation.",
    "Presence of a nutrient does not imply that a food provides a clinically meaningful dose - see per-entry notes for known caveats.",
    "No quantities, RDA/NRV values or adequacy claims are encoded.",
    "M014 Chloride is deliberately excluded - no food in this catalogue has a genuinely differentiating dietary source distinct from ordinary table salt."
  ],
  "count": 283,
  "relationships": [
    {
      "foodId": "FD001",
      "nutrients": [
        {
          "id": "M006",
          "strength": 4,
          "confidence": "High",
          "notes": null
        },
        {
          "id": "M007",
          "strength": 3,
          "confidence": "Moderate",
          "notes": null
        },
        {
          "id": "M008",
          "strength": 2,
          "confidence": "Emerging",
          "notes": null
        },
        {
          "id": "M013",
          "strength": 3,
          "confidence": "Moderate",
          "notes": null
        },
        {
          "id": "V002",
          "strength": 3,
          "confidence": "High",
          "notes": null
        }
      ]
    },
    {
      "foodId": "FD002",
      "nutrients": [
        {
          "id": "V013",
          "strength": 2,
          "confidence": "Emerging",
          "notes": null
        }
      ]
    },
    {
      "foodId": "FD003",
      "nutrients": [
        {
          "id": "M007",
          "strength": 3,
          "confidence": "Moderate",
          "notes": null
        },
        {
          "id": "V010",
          "strength": 3,
          "confidence": "Moderate",
          "notes": null
        }
      ]
    },
    {
      "foodId": "FD004",
      "nutrients": [
        {
          "id": "V010",
          "strength": 4,
          "confidence": "High",
          "notes": null
        }
      ]
    },
    {
      "foodId": "FD005",
      "nutrients": [
        {
          "id": "M007",
          "strength": 3,
          "confidence": "Moderate",
          "notes": null
        },
        {
          "id": "V010",
          "strength": 3,
          "confidence": "Moderate",
          "notes": null
        }
      ]
    },
    {
      "foodId": "FD006",
      "nutrients": [
        {
          "id": "M005",
          "strength": 4,
          "confidence": "High",
          "notes": null
        },
        {
          "id": "M006",
          "strength": 4,
          "confidence": "High",
          "notes": null
        },
        {
          "id": "M007",
          "strength": 2,
          "confidence": "Emerging",
          "notes": null
        },
        {
          "id": "M010",
          "strength": 3,
          "confidence": "Moderate",
          "notes": null
        },
        {
          "id": "V001",
          "strength": 4,
          "confidence": "High",
          "notes": null
        },
        {
          "id": "V003",
          "strength": 2,
          "confidence": "Moderate",
          "notes": null
        },
        {
          "id": "V006",
          "strength": 2,
          "confidence": "Moderate",
          "notes": null
        },
        {
          "id": "V008",
          "strength": 5,
          "confidence": "High",
          "notes": null
        },
        {
          "id": "V012",
          "strength": 2,
          "confidence": "Moderate",
          "notes": null
        },
        {
          "id": "V013",
          "strength": 5,
          "confidence": "High",
          "notes": null
        }
      ]
    },
    {
      "foodId": "FD007",
      "nutrients": [
        {
          "id": "M001",
          "strength": 3,
          "confidence": "Moderate",
          "notes": null
        },
        {
          "id": "M005",
          "strength": 3,
          "confidence": "Moderate",
          "notes": null
        },
        {
          "id": "M016",
          "strength": 2,
          "confidence": "Emerging",
          "notes": null
        },
        {
          "id": "V001",
          "strength": 4,
          "confidence": "High",
          "notes": null
        },
        {
          "id": "V008",
          "strength": 4,
          "confidence": "High",
          "notes": null
        },
        {
          "id": "V010",
          "strength": 4,
          "confidence": "High",
          "notes": null
        },
        {
          "id": "V013",
          "strength": 5,
          "confidence": "High",
          "notes": null
        }
      ]
    },
    {
      "foodId": "FD008",
      "nutrients": [
        {
          "id": "M001",
          "strength": 3,
          "confidence": "Moderate",
          "notes": null
        },
        {
          "id": "V010",
          "strength": 3,
          "confidence": "Moderate",
          "notes": null
        },
        {
          "id": "V013",
          "strength": 4,
          "confidence": "High",
          "notes": null
        }
      ]
    },
    {
      "foodId": "FD009",
      "nutrients": [
        {
          "id": "M010",
          "strength": 3,
          "confidence": "Moderate",
          "notes": null
        },
        {
          "id": "V008",
          "strength": 3,
          "confidence": "Moderate",
          "notes": null
        },
        {
          "id": "V013",
          "strength": 5,
          "confidence": "High",
          "notes": null
        }
      ]
    },
    {
      "foodId": "FD010",
      "nutrients": [
        {
          "id": "M001",
          "strength": 2,
          "confidence": "Emerging",
          "notes": null
        },
        {
          "id": "M002",
          "strength": 3,
          "confidence": "Moderate",
          "notes": null
        },
        {
          "id": "M016",
          "strength": 3,
          "confidence": "Moderate",
          "notes": null
        },
        {
          "id": "V005",
          "strength": 2,
          "confidence": "Moderate",
          "notes": null
        },
        {
          "id": "V008",
          "strength": 4,
          "confidence": "High",
          "notes": null
        },
        {
          "id": "V010",
          "strength": 4,
          "confidence": "High",
          "notes": null
        },
        {
          "id": "V012",
          "strength": 2,
          "confidence": "Emerging",
          "notes": null
        },
        {
          "id": "V013",
          "strength": 4,
          "confidence": "High",
          "notes": null
        }
      ]
    },
    {
      "foodId": "FD011",
      "nutrients": [
        {
          "id": "M016",
          "strength": 3,
          "confidence": "Moderate",
          "notes": null
        },
        {
          "id": "V008",
          "strength": 3,
          "confidence": "Moderate",
          "notes": null
        },
        {
          "id": "V010",
          "strength": 4,
          "confidence": "High",
          "notes": null
        },
        {
          "id": "V013",
          "strength": 4,
          "confidence": "High",
          "notes": null
        }
      ]
    },
    {
      "foodId": "FD012",
      "nutrients": [
        {
          "id": "V010",
          "strength": 3,
          "confidence": "Moderate",
          "notes": null
        }
      ]
    },
    {
      "foodId": "FD013",
      "nutrients": [
        {
          "id": "M016",
          "strength": 3,
          "confidence": "Moderate",
          "notes": null
        },
        {
          "id": "V010",
          "strength": 3,
          "confidence": "Moderate",
          "notes": null
        },
        {
          "id": "V013",
          "strength": 3,
          "confidence": "Moderate",
          "notes": null
        }
      ]
    },
    {
      "foodId": "FD014",
      "nutrients": [
        {
          "id": "M005",
          "strength": 5,
          "confidence": "High",
          "notes": null
        },
        {
          "id": "M008",
          "strength": 3,
          "confidence": "Moderate",
          "notes": null
        },
        {
          "id": "M009",
          "strength": 2,
          "confidence": "Emerging",
          "notes": null
        },
        {
          "id": "M013",
          "strength": 2,
          "confidence": "Emerging",
          "notes": null
        },
        {
          "id": "V002",
          "strength": 3,
          "confidence": "High",
          "notes": null
        },
        {
          "id": "V008",
          "strength": 5,
          "confidence": "High",
          "notes": null
        }
      ]
    },
    {
      "foodId": "FD015",
      "nutrients": [
        {
          "id": "M003",
          "strength": 2,
          "confidence": "Emerging",
          "notes": null
        },
        {
          "id": "M005",
          "strength": 4,
          "confidence": "High",
          "notes": null
        },
        {
          "id": "M007",
          "strength": 2,
          "confidence": "Emerging",
          "notes": null
        },
        {
          "id": "M008",
          "strength": 3,
          "confidence": "Moderate",
          "notes": null
        },
        {
          "id": "M013",
          "strength": 3,
          "confidence": "Moderate",
          "notes": null
        },
        {
          "id": "V002",
          "strength": 3,
          "confidence": "Moderate",
          "notes": null
        },
        {